username,rating,useful,text,hashtags,retweets,date,mentions
ETHClassicPrice,0,0,Ethereum Classic value: $29.57,,0,2018-01-18 23:59:50,
ETHSpeculator,0,0,Ethereum value: $1014.66,,0,2018-01-18 23:59:47,
blockchainhelpr,0,0,What Is Hashing? Under The Hood Of Blockchain http://dld.bz/fYBvJ # Blockchain # Ethereum # bitcoinpic.twitter.com/beyHzBODJV,# # #,0,2018-01-18 23:59:01,
okuribitoninaru,0,0,超警告 いまTwitterで「Ethereumのハードフォークが完了しました。MyEtherWalletで確認しよう」という内容のブログ記事が拡散されてます でもそのMyEtherWalletのリンクがフィッシングサイト 根こそぎ奪われるので気をつけてください,,1,2018-01-18 23:58:40,
CointalUK,0,0,"Both systems are co-existing alongside each other. But for how long? Knowing that the banks are already rethinking certain areas. Trade Bitcoin, Ripple, Ethereum Litecoin & Bitcoin Cash now all available on http://cointal.com  , P2P. # BTC # ETH # XRP # LTC # BCH # CointalQuotespic.twitter.com/683WHEfQGv",# # # # # #,0,2018-01-18 23:58:38,
ICOKorea,0,0,# ICO # bitcoin # ethereum # dash # litecoin future of cryptocurrency exchang # # presale # ico # crypto # cryptocurrency # 가상화폐 # 암호화폐,# # # # # # # # # # # #,0,2018-01-18 23:58:05,
iveta_scott,0,0,Another Ethereum based ICO unable to function properly because of Ethereum's poor scalability. https://twitter.com/dragonchaingang/status/954085361789161472 …,,0,2018-01-18 23:57:43,
Giumabo,0,0,Venezuela elige Ethereum para lanzar ICO del Petro y a Decred para crear una red blockchain propia https://www.criptonoticias.com/adopcion/venezuela-elige-ethereum-ico-petro-decred-crear-red-blockchain-propia/ …,,0,2018-01-18 23:57:40,
cryptoreport,0,0,http://Graft.co  domain forsale # Fintech # Bitcoin # Bitcoins # BTC $ BTC # Bitcoincash # Blockchain # Blockchains # Ethereum # Ether # Eth # Etc # Litecoin # LTC # Crypto # Cryptos $ CRYPTO # Cryptocurrency # Cryptocurrencies # CryptoNews # AltCoins # ICO # ITO # GoDaddy # Sedo # Afternic # Flippa,# # # # # # # # # # # # # # # # # # # # # # # # #,0,2018-01-18 23:57:33,
MarkWosk,0,0,MAPSVerified account @ MAPS Following Following @ MAPS More PRESS RELEASE: # PineappleFund Offers $4 Million Matching Grant to @ MAPS http://maps.org/pinefund4million … … # Psychedelics # Cryptocurrency # Bitcoin # BTC # Litecoin # Ethereum # Blockchain,# # # # # # # #,0,2018-01-18 23:57:16,@ @ @
little_crypto,0,0,New place to trade with $500 of transaction fees offer ! http://upcoin.com/?ID=45ee66cb # Bitcoin # altcoins # cryptocurrency # crypto # btc # LTC # eth # Ethereum # XVG # XRP # xlm # stellar,# # # # # # # # # # # #,0,2018-01-18 23:57:07,
Rubencoin,0,0,"Can we expect any more of this, ethereum.",,0,2018-01-18 23:57:01,
Be_Khalil,0,0,Project Robox Token RBX AIRDROP#1 has just started! Stay tuned for updates ! https://docs.google.com/forms/d/e/1FAIpQLSerpYyRtpA0iPrhKKSm1JVBvISsfn9lJ1SMocvVKe-hLw3T_A/viewform?usp=sf_link … … # airdrop # airdropalert # airdrops # bounty # bountyhunter # crypto # cryptocurrencies # blockchain # Bitcoin # ethereum # BTC # ETH https://twitter.com/ProjectRobox/status/954101811572563968 …,#1 # # # # # # # # # # # #,0,2018-01-18 23:56:50,
CryptoC7,0,0,"""JOIN"" our Telegram channel today to get quality signals for free!!! # KMD # Komodo # BTCD # ETC # BTC # Stratis # coinexchange # cryptocurrency # Litecoin # crypto # ETH # Bitcoin # altcoin # trading # blockchain # ethereum # HODL # Bittrex # Binance # IOP # RCN # LBC # XELpic.twitter.com/tgY1C7A6iO",# # # # # # # # # # # # # # # # # # # # # # #,0,2018-01-18 23:56:40,
glenncrews2,0,0,For me large stake in Ethereum - Neo - Neblio - Genesis Vision - Lunyr : Small stake in Gas - Bitcoin - Litecoin - Ambrosus - BQX - Modum,,0,2018-01-18 23:56:36,
cryptoball,0,0,Technology is not a product.The product is what you do with the technology.The product is what sells.What is Ethereum product? # XRP # ripplehttps://twitter.com/antiprosynth/status/954135370047868928 …,# #,0,2018-01-18 23:56:17,
NF_BitcoinDon,0,0,I received 0.0098342 Ethereum. # instagc # free # cash http://instagc.com/124102,# # #,0,2018-01-18 23:56:13,
blockmasonio,0,0,Blockmason is pleased to be joining the HitBTC family in a few weeks! # creditprotocol # bcpt # Ethereum # Blockchain # blockmasonpic.twitter.com/E4vcBCDxDx,# # # # #,89,2018-01-18 23:56:02,
iTruck_NEWS,0,0,"ArtByte 2017 Investment Return Data Show It Outperformed BitCoin, Litecoin and Ethereum Combined http://itruck.news/artbyte-2017-investment-return-data-show-it-outperformed-bitcoin-litecoin-and-ethereum-combined/ …",,0,2018-01-18 23:55:37,
gokaeisuriku,0,0,「イーサリアムEthereum」メトロポリスのハードフォークが延期の可能性 http://bitme.site/posts/23191,,0,2018-01-18 23:55:30,
ikabutsugoshika,0,0,なぜEthereumイーサリアムは時価総額4兆円を突破したのかhttp://bitme.site/posts/24053,,0,2018-01-18 23:55:28,
Cryptoworld1001,0,0,Give me your # hodl energy! # bitcoin # blockchain # altcoin # ethereum # litecoin # monero # iota # dash # bitcoincash # verge # cryptocurrency # cryptocurrenciespic.twitter.com/6oUqaq92XO,# # # # # # # # # # # # #,0,2018-01-18 23:55:14,
babbarshera,0,0,# Internet and # Blockchain Comparison # Fintech # makeyourownlane # Mpgvip # cryptocurrency # defstar5 # ETHEREUM # Bitcoin # IoT # chatbots # chatbot # banking # BitcoinMining # Databreach # Ransomware # Hackers # infosec # malware # cybersecurity # infosec # cybersec # AI # ML # DLpic.twitter.com/qP1fFYoRFK,# # # # # # # # # # # # # # # # # # # # # # # # #,13,2018-01-18 23:55:07,
CryptoCurrent,0,0,[RKT] The GBX Sponsor Firm Rules – GBX – Medium http://dlvr.it/QBq3pn # ethtrader # ethereum # crypto # reddit,# # # #,0,2018-01-18 23:55:07,
ReusTouch,0,0,$ BTC $ XVG $ ETH $ BAT $ XRP # bitcoin # ethereum # ripple,# # #,0,2018-01-18 23:55:04,
CryptoC7,0,0,"""JOIN"" our Telegram channel today to get quality signals for free!!! # KMD # Komodo # BTCD # ETC # BTC # Stratis # coinexchange # cryptocurrency # Litecoin # crypto # ETH # Bitcoin # altcoin # trading # blockchain # ethereum # HODL # Bittrex # Binance # IOP # RCN # LBCpic.twitter.com/LPLFrZ28gf",# # # # # # # # # # # # # # # # # # # # # #,0,2018-01-18 23:55:02,
Mashahers,0,0,Ethereum Lyte (Elyte)2nd social media Bounty https://docs.google.com/forms/d/e/1FAIpQLScf9ORCo55gpLT9kIJA2kjR0ugWUeT5lDQg9GPgZ6RlW2Nc4A/viewform …,,0,2018-01-18 23:55:00,
kripto_baba,0,0,Kripto piyasasında son durum Piyasaların düzelmesi 1 ay bulur. Şuan herkes acaba yeniden düşer mi? Endişesi var. # ripple # tron # xlm # IOTA # poe # xvg # ada # DigiByte # dogecoin # Bitcoin # Ethereum # litecoin pic.twitter.com/RxPIgdzTYD,# # # # # # # # # # # #,0,2018-01-18 23:54:43,
KendalGunter2,0,0,Ethereum Classic $ ETC price: $29.65 Trade with up to 100x Leverage on Bitmex! http://bitmex.com/register/6vXB0G $ ECC $ ION $ MER $ VIBE $ PPT $ MANA $ BLUE $ XSH $ EMER $ DCT $ EXCL $ SEQ $ QVT $ UTK $ SLR $ AEON $ ADA $ QSP $ INCNT $ TOPC $ VIA $ ENJ $ PREpic.twitter.com/YzKvpt2LD0,,0,2018-01-18 23:54:20,
iveta_scott,0,0,"They say Ethereum is better than Bitcoin. They say Ethereum is the ""future"". https://twitter.com/whiteghost/status/954065241750388741 …",,0,2018-01-18 23:54:02,
Bountybeliever,0,0,SOFIN is the peer-to-peer platform for fiat currency lending based on blockchain. Join! https://www.facebook.com/sofinplatform   https: / / sofin .io / # ICO # PreICO # Blockchain # crowdsale # ethereum # Sofin # SOFINb1pic.twitter.com/XXXjCAOuQW,# # # # # # #,0,2018-01-18 23:54:02,
gefander,0,0,Where can I find a guide on the pay with bitcoin's? what is more convenient and easier to pay with bitcoin or Ethereum?,,0,2018-01-18 23:54:02,
ParrNetwork,0,0,Fresh off the ICO @ lendconnect Platform is running flawless. Get in now or miss the next largest lending platform ONLY 2 mil coins in circulation!!! 5mil total!!!!!!!!!! https://dashboard.lendconnect.io/ref/parr1212 # bitcoin # BitcoinCash # Ethereum # bitconnect # cryptocurrencies # lendconnect # Stakingpic.twitter.com/43zE4Ynezh,# # # # # # #,0,2018-01-18 23:53:40,@
babbarshera,0,0,Smart Contracts realizing true benefits of # Blockchain # Fintech # makeyourownlane # Mpgvip # cryptocurrency # defstar5 # ETHEREUM # Bitcoin # IoT # chatbots # chatbot # banking # BitcoinMining # Databreach # Ransomware # Hackers # infosec # malware # cybersecurity # infosec # cybersec # AI # ML # DLpic.twitter.com/P0PSzuKPPI,# # # # # # # # # # # # # # # # # # # # # # # #,2,2018-01-18 23:53:17,
CyrusToday,0,0,"The Palm Beach Gardens company will analyze Bitcoin, Ethereum and dozens of other virtual currencies... http://www.palmbeachpost.com/business/amid-bitcoin-craze-weiss-ratings-launches-cryptocurrency-grades/xENHLOxfZetrTxG9vxlXVO/ …",,0,2018-01-18 23:53:17,
withego,0,0,The process of verifying transactions and securing # Blockchain's ledgers against attacks called mining is not actually that decentralized in either system. # Bitcoin and # Ethereum are open # Blockchain systems meaning that in principle anyone can be a miner.https://www.technologyreview.com/s/610018/bitcoin-and-ethereum-have-a-hidden-power-structure-and-its-just-been-revealed/?utm_source=twitter.com&utm_medium=social&utm_content=2018-01-18&utm_campaign=Technology+Review …,# # # #,1,2018-01-18 23:53:12,
Blawksy,0,0,# BTC PR: PodOne Adds Veteran Industry Insider to Team and Launches # ICO to Revolutionize the Contact Center Industry http://s.blawks.com/QBq3Rs # Ethereum # Cryptopic.twitter.com/ZrkhDpIqgw,# # # #,0,2018-01-18 23:53:08,
Matt_Herrera415,0,0,If Ethereum ever drops to $700 im buying two more and deleting my coinbase app,,0,2018-01-18 23:52:52,
Smashinpounds,0,0,"Check out this free app from Coinbase that lets you conveniently and securely store, and trade digital currencies like bitcoin and ethereum. You can get it from http://goo.gl/cb5NZe",,0,2018-01-18 23:52:46,
OwenTheOnly1,0,0,"Dont aim to solve to begin with? Bitcoin and Ethereum have been around for years & years!? It seems that Bitcoin has become a tool for big players to use to make money with ups and downs, now I don’t know about ethereum, but Ripple seem to have a plan to make a business long-term",,0,2018-01-18 23:52:45,
stevelongoria,0,0,The DAI stablecoin has been perfectly stable during this market crash. Congrats MakerDAO!! : ethereum https://www.reddit.com/r/ethereum/comments/7r3ji0/the_dai_stablecoin_has_been_perfectly_stable/ … # brave,#,0,2018-01-18 23:52:44,
santyalexandez,0,0,"@ CriptoNoticias por qué si la red de # bitcoin sigue experimentando gran tráfico y las transacciones requieren exagerados fees, sigue aumentado la dificultad de minado de la # blockchain? Agradecería tu respuesta. # btc # mineria # Ethereum # ether",# # # # # #,0,2018-01-18 23:52:43,@
patcologne11,0,0,RT: @ Cointelegraph-. @ Poloniex ’s users complained of their account balances reflecting inaccurate or even negative amounts:… https://twitter.com/i/web/status/954111186185998336 … # kidec # blockchain # bitcoin # btc # ethereum,# # # # #,0,2018-01-18 23:52:41,@ @
cryptopsyched,0,0,Are you looking forward to hearing what # sterlingluxan the # psychologicanarchist has to say at the # cryptopsychedelic # initialeventoffering in # tulum has to say? we are! # bitcoin # ethereum @ psymposia @ sitaramdas @ decentranetpic.twitter.com/WQm9MDjhYC,# # # # # # #,0,2018-01-18 23:52:28,@ @ @
cot_criptomoeda,0,0,"O valor médio das criptomoedas é: Bitcoin(BTC) R$ 38020,97 Litecoin(LTC) R$ 742,92 Bitcoin Cash(BCH) R$ 7232,23 Ethereum(ETH) R$ 2998,93 # bitcoin # litecoin # bitcashcoin # ethereum",# # # #,0,2018-01-18 23:52:27,
jschulmansr,0,0,"Check out this free app from Coinbase that lets you conveniently and securely store, and trade digital currencies like bitcoin and ethereum. You can get it from http://goo.gl/cb5NZe",,0,2018-01-18 23:52:20,
CryptooSID,0,0,"Just signed up for Sphere, a global social network. Sign up & get 50 Token FREE!!! @ SphereOfficial1 https://sphere.social/?ref_code=5309-548ad037 … # TRX # Verge # XVG # XRP # Cardano # ADA # CryptoNews # cryptocurrency # Altcoins # Bittrex # Cryptopia # Poloniex # bitcoin # Ethereum # ripple # Coinbase",# # # # # # # # # # # # # # # #,0,2018-01-18 23:52:19,@
findingreview,0,0,"CLOUT Just Launched On Coinbene, Singapore’s Leading Cryptocurrency Exchange by http://Bitcoinist.net # bitcoinist http://ift.tt/2ETZHzB # cryptocurrency # bitcoin # altcoin # ethereum # blockchainpic.twitter.com/2QpOPT5xvF",# # # # # #,0,2018-01-18 23:52:05,
nameaholics,0,0,"more # Bitcoin, # Cryptocurreny & # ETHEREUM / Eth Startup Names. Calling All # Startups! # Bitcoin, # Coin, # Eth - http://BitcoinAppy.com  - http://CoinAppy.com  - http://BitcoinOT.com  - http://CoinHer.com  - http://SupremoCrypto.com  - http://CryptoCurrencyy.com pic.twitter.com/3KO9mAfeBH",# # # # # # #,0,2018-01-18 23:52:03,
AllartSoftworks,0,0,Bitcoin Bull Tom Lee Goes Hyperbolic on Latest Price Forecast https://www.bloomberg.com/news/articles/2018-01-18/bitcoin-bull-tom-lee-goes-hyperbolic-on-latest-price-forecast … # Bitcoin # Cryptocurrency # Token # marketingtips # ico # Coinbase # ethereum # ETH # Ripple # blockchain # Airdrop # Forex # Exchange # wallet,# # # # # # # # # # # # # #,1,2018-01-18 23:51:50,
DimeWhale,0,0,Why buy trx when # Dimecoin is returning? # REVIVE # blockchain # BTC # bitcoincrash # crypto # livecoin # Ethereum # XVG $ xvg # decentralize # trx # tron $ trx,# # # # # # # # # # # #,0,2018-01-18 23:51:28,
JamesLim2017,0,0,"# ETHEREUM ETH will come back and more stronger, its price is steady between $985- $1100 pic.twitter.com/eDmuyB9EC4",#,0,2018-01-18 23:51:22,
tymorapro,0,0,"$ # ETHUSD: # Ethereum (1025.01) 3mSMA50touch- (1030.53), AtPivPt, 3:1Accel+, tf:0000001, ch:-2.7%[4.2%offLo], DyVol:9T:0.1x:0.1x",# #,0,2018-01-18 23:51:19,
William73570044,0,0,Hurry to earn a 15% bonus on the Token Sale! IUNGO: The first Global Wi-FI Blockchain Network GET BONUS here: http://goo.gl/shk3Pe # news # finance # trading # bitcoin # coins # ico # ethereum # crypto # tech # invest # coin # airdrop # forex # fx # startup # BTC # fintechpic.twitter.com/G9I1UjfAQC,# # # # # # # # # # # # # # # # #,0,2018-01-18 23:50:52,
iveta_scott,0,0,"Dysfunctional Ethereum, not Bitcoin. https://twitter.com/edgelessproject/status/954046183948869633 …",,0,2018-01-18 23:50:51,
blkchninstitute,0,0,Novusphere – A Distributed Content Platform (Review) # Beyoncé # ethereum # crypto https://coinspectator.com/news/234570/novusphere-a-distributed-content-platform-review …pic.twitter.com/P1R3gwVuE7,# # #,0,2018-01-18 23:50:45,
BeyondReWA,0,0,"ArtByte 2017 Investment Return Data Show It Outperformed BitCoin, Litecoin and Ethereum Combined https://beyondwa.com/news/artbyte-2017-investment-return-data-show-it-outperformed-bitcoin-litecoin-and-ethereum-combined/ …",,0,2018-01-18 23:50:38,
i_zekel,0,0,"ArtByte 2017 Investment Return Data Show It Outperformed BitCoin, Litecoin and Ethereum Combined",,0,2018-01-18 23:50:38,
carrero,0,0,El mejor grupo de telegram de # Criptomonedas # bitcoin # Ethereum # Litecoin # Binance # bittrex # coinbase icos mining y mucho más. @bitcoinblockchainico,# # # # # # #,0,2018-01-18 23:50:19,@bitcoinblockchainico
SamsTechStuff,0,0,What are you # speculatively # mining and why? https://youtube.com/SamsTechStuff # miners # crypto # cryptocurrency # cryptocurrencynews # btc # bitcoin # BitcoinMining # ethereum # ICO # eth # fintech # ThursdayThoughts # Apple # BTSARMY # blockchain # storm # snowday # shutdown # Sidebar # FinTechs # altcoin,# # # # # # # # # # # # # # # # # # # # # # #,0,2018-01-18 23:50:16,
evaleeps,0,0,The Copytrack ICO is Currently Active! # CopytrackICO # CryptoCurrency # Crypto # Tokensale # Ethereum # Photogrpahy # Copyright Join Us--> http://copytrack.io.convey.pro/l/k0m8Jmy  by # TheLocketto via @ c0nveypic.twitter.com/Q6w8ulIFP0,# # # # # # # #,0,2018-01-18 23:50:16,@
jorgeluiherrera,0,0,"Aprende a generar DINERO DIGITAL (Bitcoin,Ethereum y otras criptomonedas) MINERÍA DE POR VIDA!!!! Ademas a la... https://fb.me/1YvE7aVki",,0,2018-01-18 23:50:13,
EfrenNeypes,0,0,# cryptocurrencynews # bitcoin # ethereum pic.twitter.com/XiLQ5z1NZZ,# # #,0,2018-01-18 23:50:10,
antiprosynth,0,0,Wealth concentration is a universal issue that blockchains don't particularly aim to solve to begin with. They tend to be more about monetary democratization. What separates Ripple from Ethereum is that XRP issuance happens by Ripple profiting directly from it though.,,0,2018-01-18 23:50:09,
MKhafid20,0,0,# trx # tron # XVG # btc # ETC # troncoin # cryptocurrency # bitcoin # eth # ethereum # xlm # xmr # ada # cardano # binance # coinbase # Dash # tron $ trx https://twitter.com/shulcaid/status/954063156879462400 …,# # # # # # # # # # # # # # # # # #,0,2018-01-18 23:49:56,
ETHNews_,0,0,"The Intercontinental Exchange (parent company of # NYSE) & Blockstream launched the # Cryptocurrency Data Feed, offering price info & order books for 15 # crypto exchanges (80% major trading volume); including # BTC, # Ethereum, # Litecoin, # Dash # Ripple & # BCH:http://ow.ly/F2KG30hS08e",# # # # # # # # #,5,2018-01-18 23:49:54,
YUNGK,0,0,I JUST WENT AN BROUGHT SUM BITCOIN THEN I WENT AN BROUGHT SUM LITECOIN THEN I WENT AN BROUGHT SUM ETHEREUM...,,0,2018-01-18 23:49:38,
CryptoLeed,0,0,"Join # Airdrop # Freecoin # Bounty of GMC # tokens. @ GMCtoken will be the biggest # ICO # TokenSale in # CloudGaming # Gaming world, # Blockchain and # Crypto # Gaming Industries. Gamer's # Decentralized Platform. # Cryptocurrency # Bitcoin # Ethereum # Altcoins # BTC # ETHhttps://docs.google.com/forms/d/e/1FAIpQLSefma-SPFpPvq4c7DuBuTsXuFC_a0R5mhfgApDBYSwZy6YeJg/viewform …",# # # # # # # # # # # # # # # # # #,1,2018-01-18 23:49:28,@
n0v0k41n3,0,0,$ VIB token 30% up today. Finally some green numbers :) @ Viberate_com # Viberate # VIB # hodl # cryptocurrency # blockchain # bitcoin # Ethereum # Spotify # iTunes # youtube # CryptoNews # btc # eth $ VIB # music pic.twitter.com/fUPoWRq5cvpic.twitter.com/U1XOM9X5vz,# # # # # # # # # # # # # #,2,2018-01-18 23:49:16,@
etherenvoy,0,0,"Because there is less than 24 hours remaining to get the word out, I thought I'd retreat this public service announcement regarding ETZ, the Ethereum Fork of 2018 https://twitter.com/jnsbitcoin/status/953149698063458304 …",,0,2018-01-18 23:49:08,
ezidlz17bor,0,0,Ethereumイーサリアム ETHとは http://bitme.site/posts/23407,,0,2018-01-18 23:49:08,
matsuu_zatsu,0,0,Ethereum programming for web developers https://happyfuncorp.com/whitepapers/webthereum …,,0,2018-01-18 23:49:04,
ShayPomeroy,0,0,"Yeah that's the idea haha. ETN is pretty small right now, but I could reasonably see it going to 0.3 or even a dollar one day. Otherwise I would just mine XMR or Ethereum.",,0,2018-01-18 23:49:04,
Ruicoin0130,0,0,ETHのハードフォークは予定通り明日朝かな？ https://minnkane.com/news/5927?page=2 … # EtherZero # Ethereum # 仮想通貨,# # #,0,2018-01-18 23:48:38,
insta_trade,0,0,"Market still cannot decide to whether go up or down. Be careful, always hold some BTC and USDT to buy the dips. # btc # xrp # xvg # xmr # dash # trx # gvt # ada # xlm # appc # poe # eth # etc # ltc # bitcoin # verge # tron # ripple # monero # ETHEREUM # Litecoin # GenesisVision # AppCoins",# # # # # # # # # # # # # # # # # # # # # # #,0,2018-01-18 23:48:37,
GhieYecla,0,0,Project Robox Token RBX AIRDROP#1 has just started! Stay tuned for updates ! https://docs.google.com/forms/d/e/1FAIpQLSerpYyRtpA0iPrhKKSm1JVBvISsfn9lJ1SMocvVKe-hLw3T_A/viewform?usp=sf_link … # airdrop # airdropalert # airdrops # bounty # bountyhunter # crypto # cryptocurrencies # blockchain # Bitcoin # ethereum # BTC # ETH https://twitter.com/ProjectRobox/status/954101811572563968 …,#1 # # # # # # # # # # # #,0,2018-01-18 23:48:21,
mercurycash,0,0,Carry the smarter way to trade Ethereum in your pocket. It’ll just take seconds to trade your money safely.,,0,2018-01-18 23:48:01,
auxiliumglobal,0,0,*autotuned voice* See you at the swap from $ sprts to # sproutsplus # cryptocurrency not # Bitcoin but # ethereum with # pos,# # # # #,0,2018-01-18 23:47:55,
atinahxqga,0,0,イーサリアムEthereumとは？ http://bitme.site/posts/23457,,0,2018-01-18 23:47:08,
ryanfujiwara,0,0,A modest primer for Ethereum programming https://buff.ly/2DMF35l,,0,2018-01-18 23:47:03,
inversionesBTC,0,0,MINERIA EN LA NUBE AL COMPRAR PODER UTILIZA ESTE CODIGO PROMOCIONAL DE DESCUENTO: BvZ6O7 # BITCOINS # ETHEREUM https://www.genesis-mining.com/a/564362,# #,0,2018-01-18 23:47:02,
luiscerdas,0,0,"Bitcoin and Ethereum Have a Hidden Power Structure, and It’s Just Been Revealed - MIT Technology Review https://www.technologyreview.com/s/610018/bitcoin-and-ethereum-have-a-hidden-power-structure-and-its-just-been-revealed/ …",,0,2018-01-18 23:46:32,
cryptoarsenal,0,0,$ ark the google of blockchain checkout https://ark.io/roadmap  Buy low Interesting things coming up soon Core revamp -> 56% completion ARVM (similar to Ethereum smart contract) --> 70% completion Push Button Deployable Blockchains --> 61% completion $ eth $ btc $ omg $ neo,,4,2018-01-18 23:45:39,
icobountyprogs,0,0,We will be posting contests to win some # crypto as they come in! # contest # contests # freemoney # referralprogram # bountyprogram # bountyprograms # ico # cryptos # cryptocurrency # bitcoin # litecoin # ethereum # money # cryptocurrencies,# # # # # # # # # # # # # # #,0,2018-01-18 23:45:26,
Kevin_Coe,0,0,Ethereum Blockchain Programming Tutorial From Scratch http://upflow.co/l/2rEV pic.twitter.com/kLC904wxzG,,0,2018-01-18 23:45:25,
RobertNdlovu,0,0,"@ Techzim @ TechnoMagZw While there is still debate about Bitcoins , there is no debate about the other blockchain powered platform - ethereum.Have tested it on Mac and Windows both as a wallet and node but its runs like something else on Linux.Installation and node in action. pic.twitter.com/4FDmRNMD9K",,0,2018-01-18 23:45:20,@ @
ralfvdz,0,0,I'm having a look at Ethereum smart contracts on the test network. Smart contracts are the most interesting part of blockchain tech imho 0x266265F77C4631dBD581CaE7055d11be720766c0,,0,2018-01-18 23:45:20,
foxesden34,0,0,"Bitcoin and Ethereum have a hidden power structure, and it’s just been revealed https://www.technologyreview.com/s/610018/bitcoin-and-ethereum-have-a-hidden-power-structure-and-its-just-been-revealed/ … by foxesden34 @ techreview # bitcoin",#,0,2018-01-18 23:45:05,@
oskaaay,0,0,Rupeeza # Airdrops Update: Rupeeza Migrated Their Token From Ethereum To Waves Platform http://mycryptodictionary.com/blog/rupeeza-migrated-token-ethereum-waves-platform/#.WmExbtoIHNE.twitter …,# #,0,2018-01-18 23:44:58,
btc_joe,0,0,"Most people call this ""the price of Ethereum"" ...that's fine. What I call it is ""incentive to hack Ethereum"" $ ETHpic.twitter.com/1pS8VdcUX0",,1,2018-01-18 23:44:56,
oskaaay,0,0,Rupeeza # Airdrops Update: Rupeeza Migrated Their Token From Ethereum To Waves Platform https://fb.me/Elj253Bg,#,0,2018-01-18 23:44:50,
auxiliumglobal,0,0,Welcome on board! See you at the swap from $ sprts to # sproutsplus # cryptocurrency # ethereum # blockchain # investing # crypto,# # # # # #,0,2018-01-18 23:44:44,
BlockChainBiz,0,0,"ArtByte 2017 Investment Return Data Show It Outperformed BitCoin, Litecoin and Ethereum Combined - PR Newswire (press release) https://www.prnewswire.com/news-releases/artbyte-2017-investment-return-data-show-it-outperformed-bitcoin-litecoin-and-ethereum-combined-300584950.html?unique_ID=636519168013753414 … via @ blockchainbiz # litecoin",#,0,2018-01-18 23:44:42,@
FreeTexan68,0,0,It is time to let the # AmericanPeople know what is happening in their name!!!!! # ReleaseTheMemo # Qanon8chan # AmazonHQ2 # WinnieThePoohDay # SeeHappy # Ethereum # DayZero # Catfish # Riverdale # FakeNewsAwards @ realDonaldTrumphttps://twitter.com/RepLeeZeldin/status/954102959394213889 …,# # # # # # # # # # #,1,2018-01-18 23:44:30,@
Ethereum_ETH,0,0,How to Invest Long-Term in Bitcoin ☞ http://ift.tt/2DlDXw0 # ethereum # bitcoinpic.twitter.com/Z8q5AMUfv0,# #,0,2018-01-18 23:44:24,
SkyUpVenture,0,0,"- ArtByte 2017 Investment Return Data Show It Outperformed BitCoin, Litecoin and Ethereum… https://goo.gl/fb/p7VWKs # Litecoin # Skyup",# #,0,2018-01-18 23:44:24,
CEOofDogecoin,0,0,"A neat idea. He is a busy dude but a longstanding friend of the # Dogecoin community and the $ DOGE - $ ETH bridge is being demoed next month! Due to the timing of each coin's release, a lot of # Ethereum holders took their first steps in # cryptocurrency with the Dogecoin!",# # #,0,2018-01-18 23:44:11,
Likota_EMC,0,0,"Bitcoin, Ethereum, Ripple e mais: página mostra o preço das 10 principais criptomoedas do mercado Bitcoin, Ethereum, Ripple e mais: página mostra o preço das 10 principais criptomoedas do mercado https://search.app.goo.gl/FvVR  Compartilhado a partir do meu Feed do Google",,1,2018-01-18 23:44:07,
icobountyprogs,0,0,Joined the NEXT Crypto Kitties yet?? # referralprogram # bountyprogram # bountyprograms # ico # crypto # cryptocurrency # bitcoin # litecoin # ethereum # money http://my.fishbank.io/go/16222 pic.twitter.com/58A6IV9e9w,# # # # # # # # # #,0,2018-01-18 23:44:04,
Cryptooon,0,0,Ethereum is cheaper and faster to transfer to Binance than Bitcoin. The transfer fees for bitcoin are not cheap!,,0,2018-01-18 23:43:55,
mukhtar6021,0,0,How To Create An Ethereum Account https://youtu.be/ZD-VYGT9PxY  via @ YouTube # blockchain,#,0,2018-01-07 23:43:05,@
mpreciado89,0,0,"And too think I wasn’t going to buy # Ethereum at 1,006... Thank god I did.",#,0,2018-01-07 23:43:00,
