username,rating,useful,text,hashtags,retweets,date,mentions
MemzTabak,0,0,# Ripple # XRP # BitcoinCash # BitcoinCore # ETH # ETC # BitcoinPrivate # Bitcoin # cryptocurrencynews # coinmarketcap # coinbase # cryptocurrency # trx # tron # litecoin # ltc # Ethereum # EthereumClassic # xlm # stellar # ADA # IOTA # DASH # DMM # Coindesk # Crypto # CryptoNewshttps://www.coindesk.com/mike-novogratz-unveils-plan-cryptocurrency-merchant-bank/?utm_content=buffer13723&utm_medium=social&utm_source=twitter.com&utm_campaign=buffer …,# # # # # # # # # # # # # # # # # # # # # # # # # # #,0,2018-01-10 23:59:52,
BarelyCivilGear,0,0,There's a new Crypto trading exchange opening next month that is offering a free $500 for fees to the first 100k users. Be quick! https://tinyurl.com/Upcoinsignup # crypto # crytocurrency # cryptocoins # ripple # xrp # bitcoin # ethereum # tron # trx # qtum # trading # EXCHANGE # new # cryptoexchangepic.twitter.com/c3Ryg8hkxy,# # # # # # # # # # # # # #,0,2018-01-10 23:59:50,
Kevinloves3d,0,0,There's a new Crypto trading exchange opening next month that is offering a free $500 for fees to the first 100k users. Be quick! https://tinyurl.com/Upcoinsignup # crypto # crytocurrency # cryptocoins # ripple # xrp # bitcoin # ethereum # tron # trx # qtum # trading # EXCHANGE # new # cryptoexchangepic.twitter.com/3EQBYcjTGo,# # # # # # # # # # # # # #,0,2018-01-10 23:59:31,
Coin_Father,0,0,# Bittrex Take Profit Sold $ LTC at $248.99 Profit: $42.24 Amount: 4.18585182 $ LTC Total: 1042.24 $ USDT # blockchain # ethereum # bitcoin # ripple # bitcoincash # crypto $ crypto # litecoin # cryptocurrency # ico # btc # cryptosignals,# # # # # # # # # # # #,0,2018-01-10 23:59:30,
Kaznachej123,0,0,Bob's Repair ICO Review (RUS) for Russian-speaking people! # Review https://youtu.be/JB02Meb3yrA # BobsRepair # TokenSale # token $ BOB # blockchain # cryptocurrency # Ethereum # ICO # CrowdSale # McAfee @ BobsRepair @ officialmcafee Official website: https://www.bobsrepair.com pic.twitter.com/QnSG3yki0O,# # # # # # # # # #,0,2018-01-10 23:59:28,@ @
crypto_craic,0,0,"Bitcoin: €12,417.58 Ethereum: €1,041.73 Litecoin: €208.25",,0,2018-01-10 23:59:12,
steven_zovko,0,0,"I doubt any of them are working, golem is designed for high end rendering, cloud is already working partnered with Amazon and google already and working, the rest are speculation. I can only think if ethereum and Xrp that has such big ties already",,0,2018-01-10 23:59:10,
NickVacante1,0,0,We're very honored to have an article about # Propy in @ MarketWatch about the first ever # RealEstate transaction and title transfer in the United States using # Blockchain and the Propy platform! $ PRO # FirstMover # USA # Bitcoin # Ethereum # MarketWatch,# # # # # # # #,0,2018-01-10 23:58:57,@
EOS__ICO,0,0,# bitcoin # ico # BTC # EOS # ETH # CRYPTO # ETHEREUM # BLOCKCHAIN # RT # TRX # RIPPLE # tron # 比特币 # 区块链 # 以太坊 # 数字货币 # 虚拟货币 # 比特币现金 # OTCBTChttps://twitter.com/EOS__ICO/status/951241747832586240 …,# # # # # # # # # # # # # # # # # # #,0,2018-01-10 23:58:50,
OlxaCoin,0,0,"Congratulations Dr. Crypto, Very Professional , You Got 10,000 OLXA. Login your account at http://OlxaCoin.com  and enjoy spreading the word. @ OlxaCoin # ICO # AirDrops # GiveAway # Crypto # CryptoCurrency # BTC # ETH # Ethereum # Token # Olxa # BitCoin # PreSale",# # # # # # # # # # # #,0,2018-01-10 23:58:44,@
wildaja12,0,0,# Airdrop # SeCured # TOKEN # ETHEREUM Receive $100 worth of Dimagna SeCured Token!! Hurry Hurry!! Our # SeCuredAirdrop just started get AirDrop #1 while you can! fill form :https://docs.google.com/forms/d/e/1FAIpQLSeAX_XDizkaOf1Q2dcfLH236M4AFeB-KgAGICkb_-nkd2A3_w/viewform …,# # # # # #1,0,2018-01-10 23:58:40,
binance_aff,0,0,# Ethereum $ ETH price: $1247.61 Register Binance and start trading $ ETH. -> https://binance.com/?ref=16091938,#,0,2018-01-10 23:58:16,
CryptoCurrent,0,0,The current state of the crypto market in one tweet http://dlvr.it/Q9jqVS # ethtrader # ethereum # crypto # reddit,# # # #,1,2018-01-10 23:58:15,
livecryptonews,0,0,"New post (Self Diagnose Your Car And The Check Engine Light) has been published on LiveCrypto News - Bitcoin, Ethereum, NEO, ICO - https://www.livecrypto.news/self-diagnose-your-car-and-the-check-engine-light/ … # Crypto # Cryptonews # CryptoCurrencies",# # #,0,2018-01-10 23:58:14,
R_Tyler_Smith,0,0,"In general, I dislike the term maximalism to describe my views, but this is an incredibly well written, cogent explanation for why the market is currently irrational and the future belongs to Ethereum “The case for Ethereum maximalism” by @ elidouradohttps://blog.elidourado.com/the-case-for-ethereum-maximalism-e6ec5dc7f7b2?source=twitterShare-ccb44c32e42b-1515628499 …",,9,2018-01-10 23:58:13,@
PhxCannabisCo,0,0,Presenting... Gelato 33 pheno A seeds by @seedjunkygenetics_jbeezy # prop203 # azmmj # weedmaps # leafly # intsaweed # topshelflife # kush # growboys # phoenixcannabisco # vegbloom # elite91 # terps #420 # blockchain # bitcoin # Ethereum pic.twitter.com/ZqedCfm2Ve,# # # # # # # # # # # # #420 # # #,1,2018-01-10 23:58:09,@seedjunkygenetics_jbeezy
econyoshi,0,0,The current state of the crypto market in one tweet # ethereum # ethhttp://youtu.be/u3Tx9Pw1P0s,# #,0,2018-01-10 23:58:06,
ICOdetected,0,0,"IT’S ON! Token purchase is ONLY available on our website dashboard. If you are purchasing somewhere else, it is a SCAM. Contribute now and get 40% BONUS. >> https://www.atfslab.io/ # atfs # atfsico # agritech # ico # crowdfunding # crowdsale # crypto # ethereum # bitcoin # blockchainhttps://twitter.com/AtfsLab/status/951091494726914048 …",# # # # # # # # # #,1,2018-01-10 23:57:58,
NickVacante1,0,0,"Ameer, definitely check out Propy! Global real estate platform, already has had a completed transaction on the ethereum block chain, an apartment was sold in Ukraine using Eth, it was purchased by Michael Arrington ceo of Tech crunch. Also live in CA.",,0,2018-01-10 23:57:57,
BCashershill,0,0,"When you found out the hub/channel owned by CIA, then dont use that channel. And once again, I can open/close my channel or get through channel with more privacy. Government creates ERC20 token, does it mean Ethereum advocating govt gatekeeper? Moron.",,0,2018-01-10 23:57:31,
OlxaCoin,0,0,"Congratulations Victor , You Got 10,000 OLXA. Login your account at http://OlxaCoin.com  and enjoy spreading the word. @ OlxaCoin # ICO # AirDrops # GiveAway # Crypto # CryptoCurrency # BTC # ETH # Ethereum # Token # Olxa # BitCoin # PreSale",# # # # # # # # # # # #,1,2018-01-10 23:57:26,@
bitencoin,0,0,Tarihinde demisim kazananlari gorelim !! # bitcoin # Ethereum https://twitter.com/bitencoin/status/940696631833395200 …,# #,0,2018-01-10 23:57:24,
Crypto_nomus,0,0,Very true. But you have to always make sure the safety's on though. Otherwise you'll shoot yourself in the face. # wabi # bitcoin # ltc # btc # xrp # ripple # xvg # verge # tron # trx # cryptocurrency # stocks # stockstowatch # litecoin # ethereum # bcc # ethhttps://twitter.com/ChampagneBossRo/status/951239598180569088 …,# # # # # # # # # # # # # # # # #,0,2018-01-10 23:56:46,
abu6333,0,0,# YourBlock will “anchor” to the public Ethereum Blockchain to prove/achieve immutability # TokenSale # blockchainhttps://yourblock.io/,# # #,0,2018-01-10 23:56:44,
_samuel_swinton,0,0,Kodak shares double on news it will be using Etereum Smart Contracts to power a photo licencing platform. https://www.marketwatch.com/story/kodak-boards-the-blockchain-bandwagon-2018-01-09 … # blockchain # cryptocurrency # Crypto # CryptoNews # ethereum $ eth # Photos # photography,# # # # # # #,0,2018-01-10 23:56:43,
TargetUpInsuran,0,0,Ethereum and Bitcoin Cash Rise as Other Cryptocurrencies Tumble https://fb.me/EFs3SXIG,,0,2018-01-10 23:56:18,
UpTarget,0,0,Ethereum and Bitcoin Cash Rise as Other Cryptocurrencies Tumble http://dlvr.it/Q9jq5J pic.twitter.com/ogS8hm4vCt,,0,2018-01-10 23:56:07,
GiveawayCrypto,0,0,Not Long Left now Make sure you have Entered! # Ethereum # ETH $ eth,# #,11,2018-01-10 23:56:02,
DoctorMon3y,0,0,Geens a Genuine Privacy and Anonimity Platform read more: https://buycryptocoin.blogspot.com/2018/01/geens-genuine-privacy-and-anonimity.html … # crytpo # cryptocurrency # cardano # ada # tron # trx # verge # xvg # siacoin # sc # bitcoin # btc # miota # iota # litecoin # ltc # ripple # xrp # stellar # xlm # nem # xem # altcoins # ethereum # eth # ico # geens,# # # # # # # # # # # # # # # # # # # # # # # # # # #,0,2018-01-10 23:56:00,
Profit__Hunters,0,0,"@ Descrow3 is a fully decentralized platform that is designed to blochaine “Ethereum”. It offers its members to make a decision on financing a project, through decentralized voting. Anti-scam project... # DEScrowpic.twitter.com/kDAGwVEfTx",#,0,2018-01-10 23:55:53,@
coinlovah,0,0,NEO versus Ethereum: Why NEO might be 2018’s strongest cryptocurrency # xbt # btc # fintech # currency # crypto http://makebitcoins.de/neo-versus-ethereum-why-neo-might-be-s-strongest-cryptocurrency …,# # # # #,0,2018-01-10 23:55:47,
bitcashcrew,0,0,"# ETH has completed a Elliot wave 1-5 and is looking at a potential A,B,C,D pattern. First stage requirements have been met. # ethereum # Cryptotraders # dailygains # bitcoin # cryptocurrency # blockchain # ethereum # litecoin # crypto # bitcoinmining # btc, # bitcoincash # bitcoinnewspic.twitter.com/8TmkX9G5Ms",# # # # # # # # # # # # # #,1,2018-01-10 23:55:34,
ThomasPitre0x,0,0,"I was looking for a good lending platform (not bitconnect) and I found a pretty good one https://homeblockcoin.com/u/TomDown  ! Here is my link, you can creat an account to judge by ourself it took 2 min :) # cryptocurrency # TRON # bitcoin # ethereum # lending # bitconnect # cash # ripple # TRX # BTC",# # # # # # # # # #,0,2018-01-10 23:55:21,
r_Ethereum,0,0,What are some of the best use cases for ethereum currently? # Ethereum http://ift.tt/2msqs7J,#,0,2018-01-10 23:55:20,
Social_Crypto,0,0,My Dad told me to think about my future and get myself a pension... Told him I invested in cryptocurrency instead and he flipped out... There's just no explaining it to some people # bitcoin # litecoin # ethereum # TRX # XRP # APPC # NEBL # XLM # IOTA # EOS,# # # # # # # # # #,2,2018-01-10 23:55:13,
w5yYD3O7HE4ODzv,0,0,"Мне понравилось видео ""Ethereum Classic - чем отличается от Ethereum и какие у этой",,0,2018-01-10 23:55:08,
crypto2k18,0,0,Ethereum price prediction #2018: Is it too late to buy # Ethereum? http://ow.ly/TK1S30hEXMG,#2018 #,0,2018-01-10 23:55:06,
priceshallcom,0,0,"Ethereum – Korean Cryptocurrency Exchanges Bithumb, Coinone Under Tax Investigation https://priceshall.com/ethereum/29467/ethereum-korean-cryptocurrency-exchanges-bithumb-coinone-under-tax-investigation/ …pic.twitter.com/ZHe0qqJHHe",,0,2018-01-10 23:54:52,
dadot88,0,0,# Airdrop # SeCured # TOKEN # ETHEREUM Receive $100 worth of Dimagna SeCured Token!! Hurry Hurry!! Our # SeCuredAirdrop just started get AirDrop #1 while you can! fill form :https://docs.google.com/forms/d/e/1FAIpQLSeAX_XDizkaOf1Q2dcfLH236M4AFeB-KgAGICkb_-nkd2A3_w/viewform …,# # # # # #1,0,2018-01-10 23:54:50,
Cryptolover7,0,0,Sapien is an erc-20 compliant cryptocurrency based on ethereum blockchain # SPN # SPNPROJECThttps://twitter.com/sapien_network/status/951121098132873217 …,# #,0,2018-01-10 23:54:47,
cunbor15,0,0,@ BTCMarkets Hi my ETH transaction is still waiting to be confirmed. It’s been 72 hours!! Transaction ID: 0xc49ca293d2f0271189be1da806d15f9afe4211eb54325248120b103dbc308661 Crypt0: Ethereum Amount: 3.31939 Btc markets address: 0x3a15cf6b8b393d3372ebd9c39a7709200b495d81,,0,2018-01-10 23:54:24,@
Ethereum_UAE,0,0,Experty Brings Professional Consultations and Blockchain Together http://ift.tt/2DiuMNU # Ethereum,#,2,2018-01-10 23:54:21,
bitsalts,0,0,"Ethereum Reaches $1,400, Despite Its Major Issues https://goo.gl/ajdRzp # cryptocurrency_ethereum # Digital_Currency # editorial # eth_pricepic.twitter.com/P7tqngExFl",# # # #,0,2018-01-10 23:54:16,
DavidakaLegend,0,0,# Giveaway! I’m Giving Away 10 $ VPX! To Enter: Retweet & Follow @ VPXCoin *Winner Picked 1/31 http://www.VPXCoin.com # bitcoin # BTC # Ethereum # ETH # blockchain # coin #$vpx # VPX # Free # XRP # Ripple # LTC,# # # # # # # # # # # # #,26,2018-01-10 23:54:02,@
cot_criptomoeda,0,0,"O valor médio das criptomoedas é: Bitcoin(BTC) R$ 45857,28 Litecoin(LTC) R$ 792,86 Bitcoin Cash(BCH) R$ 7949,22 Ethereum(ETH) R$ 3307,63 # bitcoin # litecoin # bitcashcoin # ethereum",# # # #,0,2018-01-10 23:53:53,
LitecoinChannel,0,0,# litecoin $248 on Coinbase Rebound occurring as people are leaving # Ethereum pic.twitter.com/j8QZjcsmUy,# #,3,2018-01-10 23:53:49,
KeithTurner492,0,0,Why did a Donald trump fan account just like my tweet about ethereum... gross,,0,2018-01-10 23:53:48,
inversionesBTC,0,0,MINERIA EN LA NUBE EL MEJOR HARDWARE AL COMPRAR PODER UTILIZA ESTE CODIGO PROMOCIONAL DE DESCUENTO BvZ6O7 https://www.genesis-mining.com/a/564364 # BITCOINS # ETHEREUM,# #,0,2018-01-10 23:53:46,
PENNYBUSTER1,0,0,$ BRD Bread Coin is my #1 Pick for January https://youtu.be/taXtVAuSvT0  via @ YouTube # Cryptocurrency # Blockchain # Cryptos # Altcoins # Bitcoin # Cryptocurrencies # Ethereum,#1 # # # # # # #,5,2018-01-10 23:53:46,@
Cripto_Masha,0,0,Powering decentralized # blockchain powered knowledge sharing networks. Upcoming ERC-20 Ethereum Token Sale Starts January 15th 2018 @ KnowledgeToken # ICO,# #,0,2018-01-10 23:53:36,@
c6thomas,0,0,Starting a Q&A series! Respond back to this and I’ll get back to all of you with my answers! # btc # ltc # eth # bitcoin # cryptocurrency # crypto # bitcoins # ethereum # ripple # xrp # verge # xvg # ada # cardano # xlm # lumens # powr # ethos # iota $ xrp $ xvg $ xlm $ vtc $ vtc $ ada $ eth $ powrpic.twitter.com/jNVAqnAppr,# # # # # # # # # # # # # # # # # # #,2,2018-01-10 23:53:18,
Remi_Vladuceanu,0,0,Ethereum Price Weekly Analysis – ETH/USD Target $1105 http://tribetica.com/index.php/2018/01/07/ethereum-price-weekly-analysis-eth-usd-target-1105/ … # Bitcoin # blockchain # crypto # cryptocurrency # newspic.twitter.com/DAfZoCmO2r,# # # # #,0,2018-01-10 23:53:16,
zacharious8,0,0,Ethereum at a discount come on FUD-ers grow a pair! # eth # Ethereum # bitcoinhttps://goo.gl/images/GWjW9P,# # #,1,2018-01-10 23:53:13,
FrederickMunawa,0,0,I had a great chat with @ lyotier about the @ Right_Mesh project. They’re using Ethereum to create a mesh network that allows mobile users to connect without the Internet. We could see a billion people connected in the developing world - http://blockchain.global/iTunes,,0,2018-01-10 23:52:19,@ @
AlertTrade,0,0,"CryptoCurrency News: Ethereum Reaches $1,400, Despite Its Major Issues http://dlvr.it/Q9jpNJ  via → http://bit.do/_BINANCE pic.twitter.com/cEB0JsEAyD",,2,2018-01-10 23:52:10,
aedison,0,0,"hi leon, I mortgaged my house to buy bitcoin, and then refinanced it to buy ethereum. I’m trying to re-refinance to pick up extra leon coin, but the interest rate is pretty steep (45%). do you recommend I go ahead with it?",,7,2018-01-10 23:51:38,
JumboNetworks,0,0,A crypto expert on whether bitcoin or ethereum should be worth more http://read.bi/2CRMH0S  via @ clusterstock,,0,2018-01-10 23:51:36,@
HDSTUDI0S,0,0,Ethereum Live!: http://youtu.be/W_6uv8WSrCc?a  via @ YouTube,,0,2018-01-10 23:51:27,@
ethtracker,0,0,Ethereum price USD: 1244.34 EUR: 1030.72,,0,2018-01-10 23:50:45,
ETHSpeculator,0,0,Ethereum value: $1242.51,,0,2018-01-10 23:50:16,
ETHClassicPrice,0,0,Ethereum Classic value: $36.37,,0,2018-01-10 23:50:13,
CryptoCurrent,0,0,3 days waiting on a transaction http://dlvr.it/Q9jnym # ethereum # ethereum # eth # ether # reddit,# # # # #,0,2018-01-10 23:50:11,
CryptoCurrent,0,0,Any idea why this is taking so long? http://dlvr.it/Q9jnyL # ethereum # ethereum # eth # ether # reddit,# # # # #,0,2018-01-10 23:50:10,
mysql_projects,0,0,Build Ethereum online Wallet for ERC20 token https://goo.gl/fb/n425ic,,0,2018-01-10 23:49:56,
RoseVLB,0,0,Moedas Digitais: futuro do mercado financeiro? # Bitcoin # Ethereum # MercadoFinanceiro # MoedasDigitais # Tecnologia # AgoraNewspic.twitter.com/DLcpCMYKzM,# # # # # #,0,2018-01-10 23:49:35,
ChampagneBossRo,0,0,# wabi # bitcoin # ltc # btc # xrp # ripple # xvg # verge # tron # trx # cryptocurrency # stocks # stockstowatch # litecoin # ethereum # bcc # eth @ CNBCFastMoneyhttps://twitter.com/StartaleTV/status/951092830046507008 …,# # # # # # # # # # # # # # # # #,0,2018-01-10 23:49:28,@
crypto_folie,0,0,The coin universe keeps expanding # infographics # Bitcoin # Ripple # Ethereum # Litecoin # Moneropic.twitter.com/ZPZ0CfjzDo,# # # # # #,1,2018-01-10 23:49:26,
suepiper112y,0,0,Ethereum $ ETH price: $1228.84 Long/Short Bitcoin swings with up to 100x Leverage at Bitmex! http://bitmex.com/register/6vXB0G $ XP $ PRL $ TRST $ MUE $ NXS $ TCC $ SONM $ KCS $ XIOS $ BRK $ DASH $ DOGE $ ADX $ DOPE $ PART $ WGR $ CANN $ BLOCK $ GEO $ XEL $ XAS $ OK $ XCPpic.twitter.com/YfUEPxC0E7,,0,2018-01-10 23:48:50,
LlamaCoins,0,0,# binance # bitcoin # ethereum # altcoin # shitcoin Binance Sign ups are now open: https://www.binance.com/?ref=12596077,# # # # #,0,2018-01-10 23:48:40,
TheReal_KDubb,0,0,In 2018 Ethereum Value Could Triple Leaving Bitcoin Behind – CoinSpeaker - http://klou.tt/16rmnufsi8jdt,,0,2018-01-10 23:48:28,
inversionesBTC,0,0,MINERÍA EN LA NUBE DISPONIBLE CONTRATOS YA # BITCOINS # ETHEREUM # DASH # ZCASH https://hashflare.io/r/D3340D25 pic.twitter.com/V1OjoUD3yR,# # # #,1,2018-01-10 23:48:01,
btc_update,0,0,Microsoft Welcomes Back Bitcoin – Fortune http://bit.ly/2FnTfSx # bitcoin # ethereum # btc # crypto # blockchain,# # # # #,0,2018-01-10 23:47:42,
JeffEsTake,0,0,NICE CHART AND FORECAST ON IOTA 1/10 # IOTA # cryptocurrency # ethereum # yogagirl # yoga # vegan # healthhttps://steemit.com/iota/@haejin/iota-is-carving-out-a-triangle …,# # # # # # #,0,2018-01-10 23:47:40,@haejin
patcologne11,0,0,RT: @ BTCTN-Malaysia Issues Cease and Desist Order to Copycash ICO http://ift.tt/2CNMo3g # Bitcoin pic.twitter.com/Wg9NqJ7Q2e # kidec # blockchain # bitcoin # btc # ethereum,# # # # # #,0,2018-01-10 23:47:17,@
Mr_nuck,0,0,"I just published “CIBUS Advertisement platform for better brand management: boost reach, boost profit” # Cibus # Bitcoin # Ethereum # Cryptocurrency",# # # #,0,2018-01-10 23:47:17,
livecryptonews,0,0,"New post (SEC Suspends Trading in Blockchain Firm With No Revenues and No Product) has been published on LiveCrypto News - Bitcoin, Ethereum, NEO, ICO - https://www.livecrypto.news/sec-suspends-trading-in-blockchain-firm-with-no-revenues-and-no-product/ … # Crypto # Cryptonews # CryptoCurrenciespic.twitter.com/L7CekZN9LB",# # #,0,2018-01-10 23:47:16,
RodrigoFautino,0,0,"@ Poloniex @ foxbitcoin @ MercadoBitcoin @ BitrexGlobal @ bitfinex @ binance_2017 @ BLEUTRADE alert, new foundations # ethereum the new # bitcoin, we will now see great investors joining # ethereum, as they can see it is more promising than its predecessor https://twitter.com/infomoney/status/951176371732172801 …",# # #,0,2018-01-10 23:47:13,@ @ @ @ @ @ @
cryptotraderbot,0,0,# Ethereum trade bot is attempting to sell. Current price is $1234.61 (Target: $1220.14) Balance: USD: 0.18 ETH: 0.31 ($386.02 --22.80%) pic.twitter.com/9WR5ftOegN,#,0,2018-01-10 23:47:07,
tymorapro,0,0,"$ # ETHUSD: # Ethereum (1230.31) 1mAccelBandTrap+ (1xAvg), lo:1211.30, hi:1231.93, bars:4, tf:1100000, FirmTrnd+:-75%, ch:-2.3%[4.1%offLo]",# #,0,2018-01-10 23:47:02,
TheReal_KDubb,0,0,Ethereum vs Bitcoin vs Ripple’s XRP – Cyprotcurrencies Latest Price Comparison - http://klou.tt/ywqbpa2o3etm,,0,2018-01-10 23:46:57,
cryptobr4in,0,0,"ONLY 4 DAYS LEFT!!! This project will be very successful, you will not regret join to the ICO. I trust this project and i believe it will succeed @ GilPlatform Blockchain # Ethereum # TokenSale # ICOpic.twitter.com/CEMF61DqT2",# # #,0,2018-01-10 23:46:51,@
BitcoinInsidr,0,0,This Ethereum Blockchain Platform Could Revolutionize Financial Securities https://fb.me/z1lVaJuL,,0,2018-01-10 23:46:51,
bitmanija,0,0,"Welcome 2Smart Mind ICO https://goo.gl/KZKf9A # IQEON # IQclash, # Ethereum, # IQeonICOpic.twitter.com/aQCJRpe417",# # # #,0,2018-01-10 23:46:34,
darkisdarkn1,0,0,Question about Ethereum vs Ether adoption https://goo.gl/fb/6kDHZ4,,0,2018-01-10 23:46:20,
Lucky7Nico,0,0,New # Airdrops # IOS Join now http://referral.iost.io/?code=9X9dtQPx  follow the the instruction easy 69 IOS # Airdrop # tokens # Ethereum,# # # # #,1,2018-01-10 23:46:08,
shonkori,0,0,"'Ethereum may be the picks n shovels of # bitcoin but eventually it too needs a valuation"" - check this out if you have 5 mins cc: @ BKBrianKelly @ karenfinerman @ MelissaLeeCNBChttps://twitter.com/CNBCFastMoney/status/951227185972510720 …",#,0,2018-01-10 23:45:59,@ @ @
cryptoconsults,0,0,This guy is # optimistic ... # cryptocurrency # crypto # ICO # Altcoins # Token # Blockchain # market # HODL # Bitcoin # BTC # Ethereum # ETH # Ripple # XRPhttps://youtu.be/tVhQmx7SbT4,# # # # # # # # # # # # # # #,0,2018-01-10 23:45:55,
topnewskoeln,0,0,Introducing Ethereum and Solidity https://www.bitcoin-wallet.li/2018/01/11/introducing-ethereum-and-solidity-4/ …,,0,2018-01-10 23:45:43,
Purplesugar8,0,0,Ethereum Lead airdrop is now live. Join the EthereumLead community now! # Airdrop # airdropalert # EthereumLead https://twitter.com/EthereumLead/status/951165903336505344 …,# # #,0,2018-01-10 23:45:18,
eraser,0,0,Visualizing The Expanding Universe Of # Cryptocurrencies. # Infographic http://klou.tt/1m2txouydlumq # fintech # bitcoin # ethereum # edtech # elearning # insurtech # cryptocurrency # cryptoeconomy,# # # # # # # # # #,1,2018-01-10 23:45:12,
Current_ETH,0,0,https://blog.auctus.org/auctus-to-leverage-with-aragon-to-become-a-truly-decentralized-platform-2fd6b4d1178c … # Ethereum # ETH,# #,0,2018-01-10 23:45:07,
btc_time,0,0,Ethereum Price Weekly Analysis – ETH/USD Target $1105 http://dlvr.it/Q9jmNm pic.twitter.com/iMf9LmOMtL,,0,2018-01-10 23:45:05,
AnonymousCrypt3,0,0,"I think we will see a lot of Green lights the next few hours ! HODL !! I ask you not to judge me on my winners, but to judge me on my losers because I have so few. - Wolf of Wall Street # bitcoin # cryptocurrency # altcoins # Binance # coinbase # TRON # Ethereum # Ripplepic.twitter.com/3vHJHqSzv8",# # # # # # # #,0,2018-01-10 23:45:01,
SzymonTrades,0,0,Looks like we will see a nice bounce from # Ethereum has a lot of potential to see some great gains # btc # bch # BitcoinCash # XRP # Ripple # eth # ltc # litecoin # TRX # bitcoinpic.twitter.com/UqqINUtVUB,# # # # # # # # # # #,1,2018-01-10 23:44:55,
ChampagneBossRo,0,0,How high will # wabicoin go by end of february? # wabi # bitcoin # ltc # btc # xrp # ripple # xvg # verge # tron # trx # cryptocurrency # stocks # stockstowatch # litecoin # ethereum # bcc # eth @ CNBCFastMoney @ officialmcafee @ novogratz,# # # # # # # # # # # # # # # # # #,0,2018-01-10 23:44:53,@ @ @
Zaharchi,0,0,Altcoin.io - Decentralized Cryptocurrency Exchange - # bitcoin # ethereum # crypto # altcoins Sign up for early access: http://www.altcoin.io?kid=KDE67altcoin.io/?kid=KDE67,# # # #,0,2018-01-10 23:44:45,
highdration,0,0,"Check out this free app from @ Coinbase that lets you conveniently and securely store, and trade digital currencies like bitcoin and ethereum. You can get it from http://goo.gl/cb5NZe # cryptocurrency",#,0,2018-01-10 23:44:44,@
morinobonjin,0,0,マイクロソフトも参入してたのね。知らんかった。凡人まだまだ勉強せねば。 # Ethereum # ETHhttps://bitcoinlab.jp/articles/99,# #,0,2018-01-10 23:44:41,
HonorableCrypto,0,0,What Is The # Cryptocurrency of The Future? # Bitcoin $ BTC? # Ethereum $ ETH? # Altcoins? # Litecoin $ LTC # Ripple...http://youtu.be/PVgyeqovhnk?a,# # # # # #,0,2018-01-10 23:43:15,
livecryptonews,0,0,"New post (Useful Ideas For Learning Forex Trading) has been published on LiveCrypto News - Bitcoin, Ethereum, NEO, ICO - https://www.livecrypto.news/useful-ideas-for-learning-forex-trading/ … # Crypto # Cryptonews # CryptoCurrencies",# # #,0,2018-01-10 23:43:14,
mukhtar6021,0,0,How To Create An Ethereum Account https://youtu.be/ZD-VYGT9PxY  via @ YouTube # blockchain,#,0,2018-01-07 23:43:05,@
mpreciado89,0,0,"And too think I wasn’t going to buy # Ethereum at 1,006... Thank god I did.",#,0,2018-01-07 23:43:00,
socialrichness,0,0,Buy bitcoin Litcoin or ethereum on @ Kucoin Get your free free coins . . . . . # Cryptocurrency # DigitalCurrency # ripple # TRX # XVG # XRP # BTC # LTC # ETH # Cryptocurrency # Kucoin # bitcoinwallet # tradebitcoin http://socialrichness.com/Kucoin,# # # # # # # # # # # # #,0,2018-01-07 23:42:59,@
eugene20480717,0,0,"Earn points by sharing, connecting accounts and watching streams & unlock prizes! Telegram bot link: https://earn.refereum.com/Telegram/7a089f2e-c920-4e9e-b026-ec7fed3fda71 … Discord referral link: https://goo.gl/xFrKUd # Airdrop # bitcoin # ethereum # litecoin # ripple # dash # monero # dogecoin # nem # nxt # peercoin # potcoin # btc",# # # # # # # # # # # # #,0,2018-01-07 23:42:55,
dreamgotowinSFI,0,0,"Bitcoin Exchange: Bitcoin, Ethereum, Monero, Zcash / HitBTC https://fb.me/DCC33bEt",,0,2018-01-07 23:42:54,
umeshs16,0,0,"$ XVG, $ LA (LAToken), $ BLUE (Ethereum Blue)",,0,2018-01-07 23:42:50,
Ethereum_AI,0,0,$10 trillion market cap? Bigger than Nasdaq. Roughly 10% of all the world money.,,0,2018-01-07 23:42:33,
mlgkrypto,0,0,Those who sleep are going to slip out # trx # tronix # cripto # eth # Ethereum,# # # # #,0,2018-01-07 23:42:27,
JacksonJane3,0,0,i ll sell.mine for 3 ethereum,,0,2018-01-07 23:42:26,
Dimeji60354523,0,0,# airdrop # airdropalert # airdrops # bounty # bountyhunter # crypto # cryptocurrencies # blockchain # Bitcoin # ethereum # BTC # ETH # bananatoken # etherdelta # Airdropfinder,# # # # # # # # # # # # # # #,1,2018-01-07 23:42:19,
